{
	"$schema": "https://json-schema.org/draft/2020-12/schema",
	"$id": "https://beskid-lang.org/schemas/seed/workstream.schema.json",
	"type": "object",
	"properties": {
		"$schema": {
			"type": "string"
		},
		"slug": {
			"type": "string",
			"pattern": "^[a-z0-9]+(?:-[a-z0-9]+)*$"
		},
		"title": {
			"type": "string",
			"minLength": 1
		},
		"summary": {
			"type": "string",
			"minLength": 1
		},
		"order": {
			"type": "integer",
			"minimum": 0,
			"maximum": 9007199254740991
		}
	},
	"required": ["slug", "title", "summary"],
	"additionalProperties": false
}
